{
  "id": "proj_weekloom",
  "name": "Weekloom MVP",
  "description": "建立个人每周计划、项目推进和复盘系统。",
  "goal": "完成可实际使用的本地 MVP",
  "category": "personal_project",
  "status": "active",
  "progress": 20,
  "target_date": null,
  "next_action_id": "act_review_schema",
  "tags": ["电脑", "深度工作"],
  "blocked_reason": null,
  "created_at": "2026-08-10T09:00:00-05:00",
  "updated_at": "2026-08-16T10:00:00-05:00",
  "completed_at": null
}
